Symbol,Name,Last Sale,Net Change,% Change,Market Cap,Country,IPO Year,Volume,Sector,Industry
JAMF,Jamf Holding Corp. Common Stock,$39.83,0.40,1.014%,4725965480.00,United States,2020,1007384,Technology,Computer Software: Prepackaged Software
JAN,JanOne Inc. Common Stock (NV),$6.26,-0.01,-0.159%,15070387.00,United States,,103298,Public Utilities,Environmental Services
JANX,Janux Therapeutics Inc. Common Stock,$22.02,-1.06,-4.593%,916285450.00,United States,2021,43244,Health Care,Biotechnology: Pharmaceutical Preparations
JAQC,Jupiter Acquisition Corporation Common stock,$9.69,0.01,0.103%,196683250.00,United States,2021,75885,,
JAQCU,Jupiter Acquisition Corporation Units,$9.89,0.02,0.203%,0.00,United States,2021,15792,,
JAQCW,Jupiter Acquisition Corporation Warrants,$0.435,0.005,1.163%,0.00,United States,2021,4289,,
JAZZ,Jazz Pharmaceuticals plc Common Stock (Ireland),$136.91,8.83,6.894%,8401341543.00,Ireland,2007,1219978,Health Care,Biotechnology: Pharmaceutical Preparations
JBHT,J.B. Hunt Transport Services Inc. Common Stock,$171.66,0.94,0.551%,108347649844.00,United States,,380119,Transportation,Trucking Freight/Courier Services
JBLU,JetBlue Airways Corporation Common Stock,$15.69,-0.43,-2.667%,4989767596.00,United States,2002,9828305,Transportation,Air Freight/Delivery Services
JBSS,John B. Sanfilippo & Son Inc. Common Stock,$83.01,-0.26,-0.312%,952083693.00,United States,1991,17509,Consumer Non-Durables,Specialty Foods
JCIC,Jack Creek Investment Corp. Class A Ordinary Shares,$9.74,-0.03,-0.307%,420037500.00,United States,2021,60182,Finance,Business Services
JCICU,Jack Creek Investment Corp. Units,$10.00,-0.0297,-0.296%,0.00,United States,2021,34090,Finance,Business Services
JCICW,Jack Creek Investment Corp. Warrants,$0.59,0.00,0.00%,0.00,United States,2021,25500,Finance,Business Services
JCOM,j2 Global Inc. Common Stock,$138.59,2.61,1.919%,6680618831.00,United States,1999,306380,Technology,Telecommunications Equipment
JCS,Communications Systems Inc. Common Stock,$8.06,-0.09,-1.104%,78325573.00,United States,,94287,Public Utilities,Telecommunications Equipment
JCTCF,Jewett-Cameron Trading Company Common Shares,$11.11,-0.55,-4.717%,38764579.00,United States,,3073,,
JD,JD.com Inc. American Depositary Shares,$71.87,0.25,0.349%,111553451720.00,China,2014,6398160,Miscellaneous,Business Services
JFIN,Jiayin Group Inc. American Depositary Shares,$3.76,0.09,2.452%,203134000.00,China,2019,56868,Finance,Finance: Consumer Services
JFU,9F Inc. American Depositary Shares,$1.66,-0.03,-1.775%,337827730.00,China,2019,52639,Finance,Finance: Consumer Services
JG,Aurora Mobile Limited American Depositary Shares,$1.61,0.00,0.00%,189840535.00,China,2018,140796,Technology,EDP Services
JJSF,J & J Snack Foods Corp. Common Stock,$154.80,-0.05,-0.032%,2951092184.00,United States,1986,38664,Consumer Non-Durables,Specialty Foods
JKHY,Jack Henry & Associates Inc. Common Stock,$163.19,0.38,0.233%,12078344497.00,United States,1985,441235,Technology,Retail: Computer Software & Peripheral Equipment
JMPNZ,JMP Group LLC 6.875% Senior Notes due 2029,$25.192,0.002,0.008%,0.00,United States,,2110,Finance,Investment Bankers/Brokers/Service
JNCE,Jounce Therapeutics Inc. Common Stock,$7.59,0.08,1.065%,388851100.00,United States,2017,365938,Health Care,Biotechnology: Pharmaceutical Preparations
JOAN,JOANN Inc. Common Stock,$10.47,-0.15,-1.412%,441414143.00,United States,2021,492503,Consumer Non-Durables,Department/Specialty Retail Stores
JOBS,51job Inc. American Depositary Shares,$67.48,-0.33,-0.487%,4550662863.00,China,2004,231310,Technology,Diversified Commercial Services
JOFF,JOFF Fintech Acquisition Corp. Class A Common Stock,$9.78,0.01,0.102%,506115000.00,United States,2021,24330,,
JOFFU,JOFF Fintech Acquisition Corp. Unit,$9.97,-0.01,-0.10%,0.00,United States,2021,2810,,
JOFFW,JOFF Fintech Acquisition Corp. Warrant,$0.665,0.02,3.101%,0.00,United States,2021,63879,,
JOUT,Johnson Outdoors Inc. Class A Common Stock,$108.92,-2.14,-1.927%,1103054624.00,United States,,21620,Consumer Non-Durables,Recreational Products/Toys
JRJC,China Finance Online Co. Limited American Depositary Shares,$5.25,-0.05,-0.943%,12820290.00,China,2004,44891,Finance,Investment Bankers/Brokers/Service
JRSH,Jerash Holdings (US) Inc. Common Stock,$7.53,0.28,3.862%,92877415.00,United States,2018,53616,Basic Industries,Industrial Specialties
JRVR,James River Group Holdings Ltd. Common Shares,$38.72,0.56,1.468%,1443340698.00,Bermuda,2014,129352,Finance,Property-Casualty Insurers
JSM,Navient Corporation 6% Senior Notes due December 15 2043,$24.71,0.05,0.203%,0.00,United States,,37174,Finance,Finance: Consumer Services
JSPR,Jasper Therapeutics Inc. Common Stock,$8.28,0.28,3.50%,302387985.00,United States,2020,2025467,Health Care,Biotechnology: Pharmaceutical Preparations
JSPRW,Japer Therapeutics Inc. Warrants,$1.44,0.06,4.348%,0.00,United States,2020,20786,Health Care,Biotechnology: Pharmaceutical Preparations
JUGG,Jaws Juggernaut Acquisition Corporation Class A Ordinary Share,$9.80,0.06,0.616%,338100000.00,United States,2021,50757,,
JUGGU,Jaws Juggernaut Acquisition Corporation Unit,$10.01,0.00,0.00%,0.00,United States,2021,11,,
JUGGW,Jaws Juggernaut Acquisition Corporation Warrant,$1.12,0.00,0.00%,0.00,United States,2021,3,,
JUPW,Jupiter Wellness Inc. Common Stock,$1.45,-0.10,-6.452%,33244824.00,United States,2020,1223323,Health Care,Biotechnology: Pharmaceutical Preparations
JUPWW,Jupiter Wellness Inc. Warrant,$0.67,-0.1278,-16.019%,0.00,United States,2020,17341,Health Care,Biotechnology: Pharmaceutical Preparations
JVA,Coffee Holding Co. Inc. Common Stock,$4.53,-0.02,-0.44%,25859953.00,United States,2005,22490,Consumer Non-Durables,Specialty Foods
JWEL,Jowell Global Ltd. Ordinary Shares,$5.86,0.06,1.034%,149259204.00,China,2021,61919,Consumer Services,Other Consumer Services
JYAC,Jiya Acquisition Corp. Class A Common Stock,$9.7512,0.00,0.00%,131125274.00,United States,2020,110,,
JYNT,The Joint Corp. Common Stock,$96.42,1.34,1.409%,1386142019.00,United States,2014,59803,,
JZXN,Jiuzi Holdings Inc. Ordinary Shares,$1.92,-0.17,-8.134%,41139540.00,China,2021,565592,Consumer Durables,Automotive Aftermarket
KAIIW,Kismet Acquisition Two Corp. Warrant,$0.7499,0.0999,15.369%,0.00,United States,2021,3961,Finance,Business Services
KAIR,Kairos Acquisition Corp. Class A Ordinary Shares,$9.79,0.01,0.102%,337755000.00,United States,2021,23702,Finance,Business Services
KAIRU,Kairos Acquisition Corp. Unit,$10.00,0.03,0.301%,0.00,United States,2021,349,Finance,Business Services
KAIRW,Kairos Acquisition Corp. Warrant,$0.5699,-0.029,-4.842%,0.00,United States,2021,6548,Finance,Business Services
KALA,Kala Pharmaceuticals Inc. Common Stock,$2.38,-0.07,-2.857%,133422479.00,United States,2017,973229,Health Care,Biotechnology: Pharmaceutical Preparations
KALU,Kaiser Aluminum Corporation Common Stock,$109.94,-3.96,-3.477%,1743628611.00,United States,,70765,Basic Industries,Aluminum
KALV,KalVista Pharmaceuticals Inc. Common Stock,$16.95,0.07,0.415%,414221829.00,United Kingdom,2015,152759,Health Care,Biotechnology: Pharmaceutical Preparations
KARO,Karooooo Ltd. Ordinary Shares,$32.395,1.4007,4.519%,1002661079.00,Singapore,2021,4727,Technology,Computer Software: Prepackaged Software
KAVL,Kaival Brands Innovations Group Inc. Common Stock,$1.39,0.05,3.731%,32843180.00,United States,,648223,Consumer Non-Durables,Farming/Seeds/Milling
KBAL,Kimball International Inc. Class B Common Stock,$11.23,-0.14,-1.231%,413795246.00,United States,,158989,Consumer Durables,Industrial Specialties
KBNT,Kubient Inc. Common Stock,$2.98,-0.02,-0.667%,42473600.00,United States,2020,103632,Technology,EDP Services
KBNTW,Kubient Inc. Warrant,$0.88,0.1401,18.935%,0.00,United States,2020,193,Technology,EDP Services
KBSF,KBS Fashion Group Limited Common Stock,$2.91,-0.02,-0.683%,7540680.00,China,2013,18360,Consumer Non-Durables,Apparel
KC,Kingsoft Cloud Holdings Limited American Depositary Shares,$26.93,0.35,1.317%,6024889582.00,China,2020,843728,Technology,Computer Software: Prepackaged Software
KDMN,Kadmon Holdings Inc. Common Stock,$8.81,-0.07,-0.788%,1527052991.00,United States,,2040558,Health Care,Biotechnology: Pharmaceutical Preparations
KDNY,Chinook Therapeutics Inc. Common Stock,$12.32,-0.26,-2.067%,551932748.00,United States,2015,261264,Health Care,Biotechnology: Pharmaceutical Preparations
KDP,Keurig Dr Pepper Inc. Common Stock,$34.11,0.68,2.034%,48356074723.00,United States,,7420486,Consumer Non-Durables,Beverages (Production/Distribution)
KE,Kimball Electronics Inc. Common Stock,$26.92,-0.30,-1.102%,675716524.00,United States,,54472,Capital Goods,Industrial Machinery/Components
KELYA,Kelly Services Inc. Class A Common Stock,$19.03,-0.39,-2.008%,749524124.00,United States,,85529,Technology,Diversified Commercial Services
KELYB,Kelly Services Inc. Class B Common Stock,$19.06,-0.45,-2.307%,750705718.00,United States,,1147,Technology,Diversified Commercial Services
KEQU,Kewaunee Scientific Corporation Common Stock,$13.41,0.24,1.822%,37412197.00,United States,,213,Capital Goods,Medical Specialities
KERN,Akerna Corp. Common Stock,$2.72,-0.05,-1.805%,38239683.00,United States,2018,546931,Health Care,Managed Health Care
KERNW,Akerna Corp Warrant,$0.4301,-0.0501,-10.433%,0.00,United States,2018,25601,Health Care,Managed Health Care
KFFB,Kentucky First Federal Bancorp Common Stock,$7.05,-0.0204,-0.289%,57965424.00,United States,,889,Finance,Savings Institutions
KFRC,Kforce Inc. Common Stock,$63.90,-0.04,-0.063%,1382103260.00,United States,1995,99407,Technology,Diversified Commercial Services
KHC,The Kraft Heinz Company Common Stock,$37.35,0.28,0.755%,45693509530.00,United States,,3623582,Consumer Non-Durables,Farming/Seeds/Milling
KIDS,OrthoPediatrics Corp. Common Stock,$62.06,-1.20,-1.897%,1220882549.00,United States,2017,59744,Health Care,Medical/Dental Instruments
KIII,Kismet Acquisition Three Corp. Class A Ordinary Shares,$9.73,0.00,0.00%,354536875.00,United States,2021,21977,Finance,Business Services
KIIIW,Kismet Acquisition Three Corp. Warrant,$0.5498,-0.0303,-5.223%,0.00,United States,2021,7141,Finance,Business Services
KINS,Kingstone Companies Inc. Common Stock,$6.31,-0.22,-3.369%,66660727.00,United States,,29413,Finance,Specialty Insurers
KINZ,KINS Technology Group Inc. Class A Common Stock,$9.94,0.00,0.00%,342930000.00,United States,2021,79479,,
KINZU,KINS Technology Group Inc. Unit,$10.18,0.00,0.00%,0.00,United States,2020,35,,
KINZW,KINS Technology Group Inc. Warrant,$0.65,-0.029,-4.271%,0.00,United States,2021,23218,,
KIRK,Kirkland's Inc. COMMONSTOCK,$20.03,0.03,0.15%,269938962.00,United States,2002,249059,Miscellaneous,Diversified Commercial Services
KLAC,KLA Corporation Common Stock,$329.10,-2.13,-0.643%,50020797899.00,United States,1980,821069,Capital Goods,Electronic Components
KLAQ,KL Acquisition Corp Class A Common Stock,$9.78,0.01,0.102%,351468750.00,United States,2021,308881,,
KLAQU,KL Acquisition Corp Unit,$9.95,0.00,0.00%,0.00,United States,2021,200382,,
KLAQW,KL Acquisition Corp Warrant,$0.678,0.018,2.727%,0.00,United States,2021,5759,,
KLDO,Kaleido Biosciences Inc. Common Stock,$5.01,-0.25,-4.753%,213313420.00,United States,2019,160014,Health Care,Biotechnology: Biological Products (No Diagnostic Substances)
KLIC,Kulicke and Soffa Industries Inc. Common Stock,$55.22,-0.33,-0.594%,3421901067.00,Singapore,,772245,Technology,Semiconductors
KLTR,Kaltura Inc. Common Stock,$9.91,-0.39,-3.786%,1253510668.00,United States,2021,259118,Technology,EDP Services
KLXE,KLX Energy Services Holdings Inc. Common Stock,$4.37,-0.30,-6.424%,38805058.00,United States,,701459,Energy,Oilfield Services/Equipment
KMDA,Kamada Ltd. Ordinary Shares,$5.25,-0.04,-0.756%,234913161.00,Israel,2013,33361,Health Care,Biotechnology: Pharmaceutical Preparations
KMPH,KemPharm Inc. Common Stock,$8.74,-0.16,-1.798%,307243766.00,United States,,346731,Health Care,Biotechnology: Pharmaceutical Preparations
KNBE,KnowBe4 Inc. Class A Common Stock,$23.53,0.82,3.611%,3988134219.00,United States,2021,452532,Technology,Computer Software: Prepackaged Software
KNDI,Kandi Technologies Group Inc Common Stock,$4.28,-0.07,-1.609%,324894389.00,China,,592467,Capital Goods,Auto Parts:O.E.M.
KNSA,Kiniksa Pharmaceuticals Ltd. Class A Common Stock,$10.78,-0.16,-1.463%,738678662.00,United States,2018,246718,Health Care,Biotechnology: Pharmaceutical Preparations
KNSL,Kinsale Capital Group Inc. Common Stock,$163.16,-1.91,-1.157%,3720960391.00,United States,2016,68835,Finance,Property-Casualty Insurers
KNTE,Kinnate Biopharma Inc. Common Stock,$22.80,-2.16,-8.654%,995812914.00,United States,2020,125197,Health Care,Biotechnology: Pharmaceutical Preparations
KOD,Kodiak Sciences Inc Common Stock,$101.13,0.97,0.968%,5220791045.00,United States,2018,168473,Health Care,Biotechnology: Pharmaceutical Preparations
KOPN,Kopin Corporation Common Stock,$4.92,-0.09,-1.796%,450131814.00,United States,1992,1096868,Capital Goods,Industrial Machinery/Components
KOR,Corvus Gold Inc. Common Shares,$3.21,-0.0084,-0.261%,407681139.00,Canada,,27079,,
KOSS,Koss Corporation Common Stock,$15.22,-0.81,-5.053%,138680165.00,United States,,196962,Consumer Non-Durables,Consumer Electronics/Appliances
KPLT,Katapult Holdings Inc. Common Stock,$4.95,0.31,6.681%,479266994.00,United States,2019,9014012,Technology,EDP Services
KPLTW,Katapult Holdings Inc. Warrant,$1.31,0.11,9.167%,0.00,United States,2019,118663,Technology,EDP Services
KPTI,Karyopharm Therapeutics Inc. Common Stock,$5.75,-0.02,-0.347%,434109239.00,United States,2013,868422,Miscellaneous,Diversified Commercial Services
KRBP,Kiromic BioPharma Inc. Common Stock,$2.27,-0.23,-9.20%,35043554.00,United States,2020,170635,Consumer Durables,Specialty Chemicals
KRKR,36Kr Holdings Inc. American Depositary Shares,$1.53,-0.04,-2.548%,58988833.00,China,2019,19349,Miscellaneous,Business Services
KRMD,Repro Med Systems Inc. Common Stock,$2.82,0.04,1.439%,125521477.00,United States,,138422,Health Care,Medical/Dental Instruments
KRNL,Kernel Group Holdings Inc. Class A Ordinary Shares,$9.74,0.0197,0.203%,371033125.00,United States,2021,5864,Finance,Business Services
KRNLW,Kernel Group Holdings Inc. Warrants,$0.6075,0.0112,1.878%,0.00,United States,2021,11163,Finance,Business Services
KRNT,Kornit Digital Ltd. Ordinary Shares,$143.85,-0.48,-0.333%,6657026574.00,Israel,2015,191163,Capital Goods,Industrial Machinery/Components
KRNY,Kearny Financial Corp Common Stock,$12.96,0.14,1.092%,994613736.00,United States,,425341,Finance,Savings Institutions
KRON,Kronos Bio Inc. Common Stock,$19.54,-1.43,-6.819%,1099206834.00,United States,2020,172730,Consumer Durables,Specialty Chemicals
KROS,Keros Therapeutics Inc. Common Stock,$37.05,-2.78,-6.98%,864667787.00,United States,2020,181033,Consumer Durables,Specialty Chemicals
KRT,Karat Packaging Inc. Common Stock,$18.80,0.53,2.901%,370538600.00,United States,2021,14227,Capital Goods,Office Equipment/Supplies/Services
KRTX,Karuna Therapeutics Inc. Common Stock,$119.94,-2.52,-2.058%,3544376685.00,United States,2019,96414,Health Care,Biotechnology: Pharmaceutical Preparations
KRUS,Kura Sushi USA Inc. Class A Common Stock,$44.27,-0.24,-0.539%,429197561.00,United States,2019,24311,Consumer Services,Restaurants
KRYS,Krystal Biotech Inc. Common Stock,$53.12,-0.45,-0.84%,1179563703.00,United States,2017,196039,Health Care,Biotechnology: Biological Products (No Diagnostic Substances)
KSI,Kadem Sustainable Impact Corporation Class A common stock,$9.71,-0.02,-0.206%,212406250.00,United States,2021,1175,,
KSICU,Kadem Sustainable Impact Corporation Unit,$9.8913,-0.0387,-0.39%,0.00,United States,2021,200,,
KSICW,Kadem Sustainable Impact Corporation Warrant,$0.512,0.00,0.00%,0.00,United States,2021,12,,
KSPN,Kaspien Holdings Inc. Common Stock,$15.12,-0.68,-4.304%,37687628.00,United States,,2864,Consumer Services,Consumer Electronics/Video Chains
KTCC,Key Tronic Corporation Common Stock,$6.46,0.01,0.155%,69521687.00,United States,1983,30219,Technology,Computer peripheral equipment
KTOS,Kratos Defense & Security Solutions Inc. Common Stock,$21.98,-0.20,-0.902%,2724586641.00,United States,,534104,Consumer Non-Durables,Ordnance And Accessories
KTRA,Kintara Therapeutics Inc. Common Stock,$0.76,-0.0171,-2.20%,32812992.00,United States,,1627161,Health Care,Biotechnology: Pharmaceutical Preparations
KTTA,Pasithea Therapeutics Corp. Common Stock,$2.57,-0.11,-4.104%,33560013.00,United States,2021,120339,Health Care,Biotechnology: Pharmaceutical Preparations
KTTAW,Pasithea Therapeutics Corp. Warrant,$0.5001,-0.0001,-0.02%,0.00,United States,2021,1500,Health Care,Biotechnology: Pharmaceutical Preparations
KURA,Kura Oncology Inc. Common Stock,$18.80,0.07,0.374%,1246355550.00,United States,,296456,Health Care,Biotechnology: Biological Products (No Diagnostic Substances)
KURI,Alkuri Global Acquisition Corp. Class A common stock,$9.96,-0.02,-0.20%,429525000.00,United States,2021,278195,,
KURIU,Alkuri Global Acquisition Corp. Unit,$10.29,-0.03,-0.291%,0.00,United States,2021,303869,,
KURIW,Alkuri Global Acquisition Corp. Warrant,$1.385,0.025,1.838%,0.00,United States,2021,145262,,
KVHI,KVH Industries Inc. Common Stock,$9.85,0.00,0.00%,185278599.00,United States,1996,92183,Technology,Radio And Television Broadcasting And Communications Equipment
KVSA,Khosla Ventures Acquisition Co. Class A Common Stock,$9.91,0.01,0.101%,401255900.00,United States,2021,29041,,
KVSB,Khosla Ventures Acquisition Co. II Class A Common Stock,$10.04,-0.01,-0.10%,479581684.00,United States,2021,335044,,
KVSC,Khosla Ventures Acquisition Co. III Class A Common Stock,$9.82,0.01,0.102%,651362780.00,United States,2021,33592,,
KXIN,Kaixin Auto Holdings Ordinary Share,$2.26,-0.01,-0.441%,324220719.00,China,2017,853878,Finance,Business Services
KYMR,Kymera Therapeutics Inc. Common Stock,$61.81,0.34,0.553%,3154771089.00,United States,2020,186726,Consumer Durables,Specialty Chemicals
KZIA,Kazia Therapeutics Limited American Depositary Shares,$10.68,-0.02,-0.187%,140989030.00,Australia,,21025,Health Care,Biotechnology: Pharmaceutical Preparations
KZR,Kezar Life Sciences Inc. Common Stock,$8.53,-0.16,-1.841%,411084925.00,United States,2018,134875,Health Care,Biotechnology: Pharmaceutical Preparations
LAAA,Lakeshore Acquisition I Corp. Ordinary Shares,$9.84,0.01,0.102%,69818982.00,China,2021,4500,,
LAAAW,Lakeshore Acquisition I Corp. Warrant,$0.4985,0.00,0.00%,0.00,China,2021,7,,
LABP,Landos Biopharma Inc. Common Stock,$14.87,0.00,0.00%,596548682.00,United States,2021,82432,Consumer Durables,Specialty Chemicals
LAKE,Lakeland Industries Inc. Common Stock,$20.44,-0.06,-0.293%,159548017.00,United States,1986,55440,,
LAMR,Lamar Advertising Company Class A Common Stock,$116.76,1.28,1.108%,11814082478.00,United States,1996,441673,Consumer Services,Real Estate Investment Trusts
LANC,Lancaster Colony Corporation Common Stock,$174.96,1.98,1.145%,4816648800.00,United States,,83835,Consumer Non-Durables,Packaged Foods
LAND,Gladstone Land Corporation Common Stock,$22.95,0.45,2.00%,718962660.00,United States,1993,154249,Consumer Services,Real Estate Investment Trusts
LANDM,Gladstone Land Corporation 5.00% Series D Cumulative Term Preferred Stock,$25.90,-0.10,-0.385%,624252315.00,United States,,5403,Consumer Services,Real Estate Investment Trusts
LANDO,Gladstone Land Corporation 6.00% Series B Cumulative Redeemable Preferred Stock,$25.59,-0.136,-0.529%,0.00,United States,,21382,Consumer Services,Real Estate Investment Trusts
LARK,Landmark Bancorp Inc. Common Stock,$27.70,0.08,0.29%,131837707.00,United States,,575,Finance,Major Banks
LASR,nLIGHT Inc. Common Stock,$25.09,-0.24,-0.947%,1083841408.00,United States,2018,213427,Technology,Semiconductors
LAUR,Laureate Education Inc. Class A Common Stock,$17.48,-0.69,-3.797%,3291975275.00,United States,2017,1040954,Miscellaneous,Service to the Health Industry
LAWS,Lawson Products Inc. Common Stock,$51.51,0.01,0.019%,467625654.00,United States,,20984,Capital Goods,Industrial Machinery/Components
LAZR,Luminar Technologies Inc.  Class A Common Stock,$14.91,-0.28,-1.843%,5359056272.00,United States,2019,1490345,Technology,EDP Services
LAZY,Lazydays Holdings Inc. Common Stock,$21.46,-0.04,-0.186%,243136328.00,United States,,111604,Consumer Services,Other Specialty Stores
LBAI,Lakeland Bancorp Inc. Common Stock,$17.95,-0.08,-0.444%,908294215.00,United States,,83038,Finance,Major Banks
LBC,Luther Burbank Corporation Common Stock,$13.42,0.04,0.299%,694128659.00,United States,2017,15212,Finance,Commercial Banks
LBPH,Longboard Pharmaceuticals Inc. Common Stock,$9.07,-0.38,-4.021%,156143225.00,United States,2021,1528,Health Care,Biotechnology: Pharmaceutical Preparations
LBPS,4D pharma plc American Depositary Shares,$6.50,-0.24,-3.561%,146494530.00,United Kingdom,,4559,Health Care,Biotechnology: Pharmaceutical Preparations
LBPSW,4D pharma plc Warrant,$0.6801,-0.1189,-14.881%,0.00,United Kingdom,,4100,Health Care,Biotechnology: Pharmaceutical Preparations
LBRDA,Liberty Broadband Corporation Class A Common Stock,$173.90,-0.37,-0.212%,31618752242.00,United States,,105722,Consumer Services,Television Services
LBRDK,Liberty Broadband Corporation Class C Common Stock,$176.18,-1.15,-0.649%,32033305175.00,United States,,376967,Consumer Services,Television Services
LBRDP,Liberty Broadband Corporation Series A Cumulative Redeemable Preferred Stock,$27.71,-0.075,-0.27%,0.00,United States,,3908,Consumer Services,Television Services
LBTYA,Liberty Global plc Class A Ordinary Shares,$29.57,-0.42,-1.40%,16427670038.00,United Kingdom,,1046762,Consumer Services,Television Services
LBTYB,Liberty Global plc Class B Ordinary Shares,$29.80,0.00,0.00%,16555446978.00,United Kingdom,,152,Consumer Services,Television Services
LBTYK,Liberty Global plc Class C Ordinary Shares,$29.59,-0.28,-0.937%,16438781076.00,United Kingdom,,2407037,Consumer Services,Television Services
LCA,Landcadia Holdings IV Inc. Class A Common Stock,$9.75,0.00,0.00%,609375000.00,United States,2021,20,,
LCAA,L Catterton Asia Acquisition Corp Class A Ordinary Shares,$9.72,-0.01,-0.103%,348108114.00,Singapore,2021,18678,Finance,Business Services
LCAAU,L Catterton Asia Acquisition Corp Units,$9.94,0.02,0.202%,0.00,Singapore,2021,10502,Finance,Business Services
LCAAW,L Catterton Asia Acquisition Corp Warrant,$0.7249,0.0249,3.557%,0.00,Singapore,2021,6756,Finance,Business Services
LCAHU,Landcadia Holdings IV Inc. Units,$9.95,-0.02,-0.201%,0.00,United States,2021,700,,
LCAHW,Landcadia Holdings IV Inc. Warrant ,$1.00,0.00,0.00%,0.00,United States,2021,44669,,
LCAP,Lionheart Acquisition Corp. II Class A Common Stock,$9.90,0.00,0.00%,291060000.00,United States,2020,452,,
LCAPU,Lionheart Acquisition Corp. II Unit,$10.27,0.00,0.00%,0.00,United States,2020,48,,
LCAPW,Lionheart Acquisition Corp. II Warrant,$0.817,0.007,0.864%,0.00,United States,2020,11918,,
LCID,Lucid Group Inc. Common Stock,$24.29,0.27,1.124%,39316317061.00,United States,,19270711,Capital Goods,Auto Manufacturing
LCIDW,Lucid Group Inc. Warrant,$10.79,0.13,1.22%,0.00,United States,,523568,Capital Goods,Auto Manufacturing
LCNB,LCNB Corporation Common Stock,$17.59,0.03,0.171%,219881456.00,United States,,26884,Finance,Major Banks
LCUT,Lifetime Brands Inc. Common Stock,$17.45,0.04,0.23%,384015571.00,United States,1991,65668,Consumer Durables,Home Furnishings
LDHA,LDH Growth Corp I Class A Ordinary Shares,$9.74,-0.04,-0.409%,280025000.00,United States,2021,4245,Finance,Business Services
LDHAU,LDH Growth Corp I Units,$9.80,0.00,0.00%,0.00,United States,2021,3813,Finance,Business Services
LDHAW,LDH Growth Corp I Warrant,$0.77,-0.0201,-2.544%,0.00,United States,2021,2183,Finance,Business Services
LE,Lands' End Inc. Common Stock,$22.78,-0.98,-4.125%,751307795.00,United States,,190440,Consumer Services,Clothing/Shoe/Accessory Stores
LECO,Lincoln Electric Holdings Inc. Common Shares,$134.42,0.18,0.134%,7982746906.00,United States,,212443,Capital Goods,Industrial Machinery/Components
LEDS,SemiLEDS Corporation Common Stock,$7.67,0.02,0.261%,34087620.00,Taiwan,2010,50513,Technology,Semiconductors
LEE,Lee Enterprises Incorporated Common Stock,$21.99,-0.25,-1.124%,129498736.00,United States,,18624,Consumer Services,Newspapers/Magazines
LEGAW,Lead Edge Growth Opportunities Ltd Warrant,$0.7007,0.0006,0.086%,0.00,United States,2021,16429,Finance,Business Services
LEGH,Legacy Housing Corporation Common Stock (TX),$17.43,-0.10,-0.57%,421851858.00,United States,2018,17267,Basic Industries,Homebuilding
LEGN,Legend Biotech Corporation American Depositary Shares,$52.48,0.25,0.479%,7594593239.00,United States,2020,894158,Health Care,Biotechnology: Pharmaceutical Preparations
LEGO,Legato Merger Corp. Common stock,$10.50,-0.08,-0.756%,318223878.00,United States,2021,392849,,
LEGOU,Legato Merger Corp. Units,$12.905,-0.295,-2.235%,0.00,United States,2021,1609,,
LEGOW,Legato Merger Corp. Warrant,$2.51,-0.08,-3.089%,0.00,United States,2021,57157,,
LESL,Leslie's Inc. Common Stock,$20.43,-0.13,-0.632%,3877159821.00,United States,2020,1448103,Consumer Services,
LEVL,Level One Bancorp Inc. Common Stock,$29.5499,-0.1801,-0.606%,225868916.00,United States,2018,1744,,
LEVLP,Level One Bancorp Inc. Depositary Shares Each Representing a 1/100th Interest in a Share of 7.50% Non-Cumulative Perpetual Preferred Stock Series B,$27.4959,0.0023,0.008%,0.00,United States,,250,,
LEXX,Lexaria Bioscience Corp. Common Stock,$6.31,-0.13,-2.019%,36135471.00,Canada,,154895,Health Care,Biotechnology: Pharmaceutical Preparations
LEXXW,Lexaria Bioscience Corp. Warrant,$1.90,-0.19,-9.091%,0.00,Canada,,15796,Health Care,Biotechnology: Pharmaceutical Preparations
LFMD,LifeMD Inc. Common Stock,$5.85,-0.16,-2.662%,156545620.00,United States,,336622,Miscellaneous,Diversified Commercial Services
LFMDP,LifeMD Inc. 8.875% Series A Cumulative Perpetual Preferred Stock,$24.20,0.00,0.00%,0.00,United States,,14794,,
LFST,LifeStance Health Group Inc. Common Stock,$13.25,0.10,0.76%,4957469586.00,United States,2021,1070570,Health Care,Hospital/Nursing Management
