Symbol,Name,Last Sale,Net Change,% Change,Market Cap,Country,IPO Year,Volume,Sector,Industry
DOCU,DocuSign Inc. Common Stock,$265.12,8.92,3.482%,52153957552.00,United States,2018,3326568,Technology,EDP Services
DOGZ,Dogness (International) Corporation Class A Common Stock,$3.07,0.23,8.099%,97635007.00,China,2017,1444703,Consumer Durables,Miscellaneous manufacturing industries
DOMO,Domo Inc. Class B Common Stock,$81.34,0.21,0.259%,2615817615.00,United States,2018,220376,Technology,Computer Software: Prepackaged Software
DOOO,BRP Inc. (Recreational Products) Common Subordinate Voting Shares,$90.83,-2.38,-2.553%,7327634589.00,Canada,,60278,,
DORM,Dorman Products Inc. Common Stock,$94.50,-3.89,-3.954%,3007864598.00,United States,,108792,Capital Goods,Auto Parts:O.E.M.
DOX,Amdocs Limited Ordinary Shares,$76.47,-0.31,-0.404%,9681484350.00,Guernsey,,392186,Technology,EDP Services
DOYU,DouYu International Holdings Limited ADS,$3.06,-0.08,-2.548%,992693957.00,China,2019,2595847,Technology,Computer Software: Programming Data Processing
DPRO,Draganfly Inc. Common Shares,$3.2062,-0.2038,-5.977%,103053280.00,Canada,,247511,Consumer Durables,Electronic Components
DRAY,Macondray Capital Acquisition Corp. I Class A Ordinary Shares,$9.84,0.00,0.00%,316725000.00,United States,2021,16765,,
DRAYW,Macondray Capital Acquisition Corp. I Warrant,$0.5301,-0.0099,-1.833%,0.00,United States,2021,78479,,
DRIO,DarioHealth Corp. Common Stock,$12.90,0.37,2.953%,212970809.00,Israel,,115826,Health Care,Medical/Dental Instruments
DRMA,Dermata Therapeutics Inc. Common Stock,$4.22,-0.05,-1.171%,35146814.00,United States,2021,110629,Health Care,Biotechnology: Pharmaceutical Preparations
DRMAW,Dermata Therapeutics Inc. Warrant,$1.00,0.13,14.943%,0.00,United States,2021,8703,Health Care,Biotechnology: Pharmaceutical Preparations
DRNA,Dicerna Pharmaceuticals Inc. Common Stock,$19.26,-0.73,-3.652%,1497160153.00,United States,2014,732578,Health Care,Biotechnology: Commercial Physical & Biological Resarch
DRRX,DURECT Corporation Common Stock,$1.21,0.03,2.542%,275270378.00,United States,2000,511798,Health Care,Biotechnology: Pharmaceutical Preparations
DRTT,DIRTT Environmental Solutions Ltd. Common Shares,$2.94,0.02,0.685%,250864561.00,Canada,,32988,,
DRVN,Driven Brands Holdings Inc. Common Stock,$28.40,-0.37,-1.286%,4753279884.00,United States,2021,214005,,
DSAC,Duddell Street Acquisition Corp. Class A Ordinary Shares,$9.775,0.005,0.051%,213828125.00,Hong Kong,2020,1676,Finance,Business Services
DSACW,Duddell Street Acquisition Corp. Warrant,$0.67,-0.02,-2.899%,0.00,Hong Kong,2020,164,Finance,Business Services
DSEY,Diversey Holdings Ltd. Ordinary Shares,$16.47,0.40,2.489%,4961912074.00,United States,2021,293188,Consumer Durables,Specialty Chemicals
DSGN,Design Therapeutics Inc. Common Stock,$14.71,-0.38,-2.518%,810737664.00,United States,2021,52312,Health Care,Biotechnology: Pharmaceutical Preparations
DSGX,Descartes Systems Group Inc. (The) Common Stock,$78.50,0.22,0.281%,6643106931.00,Canada,,112308,,
DSKE,Daseke Inc. Common Stock,$9.67,0.12,1.257%,602670266.00,United States,2015,394500,,
DSKEW,Daseke Inc. Warrant,$0.2351,0.0034,1.467%,0.00,United States,2015,106839,,
DSP,Viant Technology Inc. Class A Common Stock,$12.67,0.38,3.092%,763432370.00,United States,2021,188579,Technology,EDP Services
DSPG,DSP Group Inc. Common Stock,$21.84,-0.06,-0.274%,528031096.00,United States,1994,151783,Technology,Semiconductors
DSWL,Deswell Industries Inc. Common Shares,$3.84,-0.15,-3.759%,61191318.00,Macau,1995,3439,Consumer Non-Durables,Plastic Products
DTEA,DAVIDsTEA Inc. Common Stock,$2.80,0.09,3.321%,73807913.00,Canada,2015,281692,,
DTIL,Precision BioSciences Inc. Common Stock,$11.01,-0.18,-1.609%,655951347.00,United States,2019,409656,Health Care,Biotechnology: Pharmaceutical Preparations
DTOC,Digital Transformation Opportunities Corp. Class A Common Stock,$9.72,0.00,0.00%,405202500.00,United States,2021,1,,
DTOCW,Digital Transformation Opportunities Corp. Warrant,$0.65,0.00,0.00%,0.00,United States,2021,24,,
DTRTU,DTRT Health Acquisition Corp. Unit,$10.14,0.04,0.396%,0.00,United States,2021,10030,,
DTSS,Datasea Inc. Common Stock,$1.89,-0.015,-0.787%,45191869.00,China,,41800,Technology,Retail: Computer Software & Peripheral Equipment
DTST,Data Storage Corporation Common Stock,$4.19,-0.02,-0.475%,28032403.00,United States,,234641,Technology,EDP Services
DTSTW,Data Storage Corporation Warrant,$1.0756,0.00,0.00%,0.00,United States,,35,Technology,EDP Services
DUNE,Dune Acquisition Corporation Class A Common Stock,$9.855,0.005,0.051%,212498438.00,United States,2021,219723,,
DUNEU,Dune Acquisition Corporation Unit,$10.20,0.08,0.791%,0.00,United States,2020,10322,,
DUNEW,Dune Acquisition Corporation Warrant,$0.7249,0.0849,13.266%,0.00,United States,2021,333096,,
DUO,Fangdd Network Group Ltd. American Depositary Shares,$1.05,0.00,0.00%,83839101.00,China,2019,153229,Technology,Computer Software: Programming Data Processing
DUOL,Duolingo Inc. Class A Common Stock,$141.45,-3.40,-2.347%,5292828012.00,United States,2021,421849,Technology,Computer Software: Prepackaged Software
DUOT,Duos Technologies Group Inc. Common Stock,$6.185,-0.0459,-0.737%,22203123.00,United States,,1015,Technology,Computer Software: Prepackaged Software
DVAX,Dynavax Technologies Corporation Common Stock,$17.69,-0.10,-0.562%,2030106027.00,United States,2004,1600758,Health Care,Biotechnology: Pharmaceutical Preparations
DWAC,Digital World Acquisition Corp. Class A Common Stock,$9.92,-0.0081,-0.082%,356500000.00,United States,2021,18643,,
DWACU,Digital World Acquisition Corp. Units,$10.1699,0.0399,0.394%,0.00,United States,2021,16333,,
DWACW,Digital World Acquisition Corp. Warrants,$0.46,-0.0263,-5.408%,0.00,United States,2021,3700,,
DWSN,Dawson Geophysical Company Common Stock,$2.13,-0.04,-1.843%,50336122.00,United States,,24249,Energy,Oil & Gas Production
DXCM,DexCom Inc. Common Stock,$541.83,1.44,0.266%,52421457029.00,United States,2005,483096,Health Care,Medical/Dental Instruments
DXLG,Destination XL Group Inc. Common Stock,$5.82,-0.18,-3.00%,369857659.00,United States,,334466,Consumer Services,Clothing/Shoe/Accessory Stores
DXPE,DXP Enterprises Inc. Common Stock,$30.40,-0.97,-3.092%,583890459.00,United States,,48838,Capital Goods,Industrial Machinery/Components
DXYN,Dixie Group Inc. (The) Common Stock,$4.67,-0.15,-3.112%,73788765.00,United States,,52818,Consumer Durables,Home Furnishings
DYAI,Dyadic International Inc. Common Stock,$5.11,-0.06,-1.161%,143484492.00,United States,,61293,Health Care,Biotechnology: Biological Products (No Diagnostic Substances)
DYN,Dyne Therapeutics Inc. Common Stock,$15.41,-0.33,-2.097%,792796775.00,United States,2020,104086,Consumer Durables,Specialty Chemicals
DYNS,Dynamics Special Purpose Corp. Class A Common Stock,$9.87,-0.02,-0.202%,290824485.00,United States,2021,38704,,
DYNT,Dynatronics Corporation Common Stock,$1.47,0.04,2.797%,25834215.00,United States,,131269,Health Care,Medical/Dental Instruments
DZSI,DZS Inc. Common Stock,$11.69,-0.11,-0.932%,317947098.00,United States,,125725,Public Utilities,Telecommunications Equipment
EA,Electronic Arts Inc. Common Stock,$134.07,-10.02,-6.954%,38153882864.00,United States,,8344344,Technology,Computer Software: Prepackaged Software
EAC,Edify Acquisition Corp. Class A Common Stock,$9.79,0.00,0.00%,337755000.00,United States,2021,5385,,
EACPU,Edify Acquisition Corp. Units,$10.00,0.00,0.00%,0.00,United States,2021,10,,
EACPW,Edify Acquisition Corp. Warrant,$0.5998,0.0299,5.247%,0.00,United States,2021,110470,,
EAR,Eargo Inc. Common Stock,$6.65,0.12,1.838%,261098199.00,United States,2020,1480781,Health Care,Medical Specialities
EAST,Eastside Distilling Inc. Common Stock,$2.50,-0.08,-3.101%,33293943.00,United States,,71726,Consumer Non-Durables,Beverages (Production/Distribution)
EBAC,European Biotech Acquisition Corp. Class A Ordinary Shares,$9.71,0.04,0.414%,159230173.00,Netherlands,2021,11536,Finance,Business Services
EBACW,European Biotech Acquisition Corp. Warrant,$0.56,0.0087,1.578%,0.00,Netherlands,2021,6668,Finance,Business Services
EBAY,eBay Inc. Common Stock,$71.54,1.57,2.244%,46504992290.00,United States,1998,4866998,Consumer Services,Catalog/Specialty Distribution
EBC,Eastern Bankshares Inc. Common Stock,$21.14,-0.01,-0.047%,3948067376.00,United States,2020,375523,Finance,Major Banks
EBET,Esports Technologies Inc. Common Stock,$21.84,-2.28,-9.453%,292656000.00,United States,2021,166141,Consumer Services,Services-Misc. Amusement & Recreation
EBIX,Ebix Inc. Common Stock,$27.81,0.73,2.696%,860537039.00,United States,,237510,Technology,EDP Services
EBMT,Eagle Bancorp Montana Inc. Common Stock,$22.335,-0.025,-0.112%,151357662.00,United States,,6274,Finance,Savings Institutions
EBON,Ebang International Holdings Inc. Class A Ordinary Shares,$1.97,0.00,0.00%,366095614.00,China,2020,3649460,Technology,Semiconductors
EBSB,Meridian Bancorp Inc. Common Stock,$21.42,0.22,1.038%,1126969132.00,United States,,190581,Finance,Major Banks
EBTC,Enterprise Bancorp Inc Common Stock,$36.02,0.02,0.056%,432960508.00,United States,,11974,Finance,Major Banks
ECHO,Echo Global Logistics Inc. Common Stock,$48.14,0.14,0.292%,1281912646.00,United States,2009,1304291,Transportation,Oil Refining/Marketing
ECOL,US Ecology Inc Common Stock,$30.62,-1.79,-5.523%,964907361.00,United States,,212752,Public Utilities,Environmental Services
ECOR,electroCore Inc. Common Stock,$1.02,-0.01,-0.971%,70879677.00,United States,2018,554287,Health Care,Biotechnology: Electromedical & Electrotherapeutic Apparatus
ECPG,Encore Capital Group Inc Common Stock,$50.10,0.21,0.421%,1516527451.00,United States,,163452,,
EDAP,EDAP TMS S.A. American Depositary Shares,$5.98,0.03,0.504%,199409893.00,France,1997,50140,Health Care,Biotechnology: Electromedical & Electrotherapeutic Apparatus
EDIT,Editas Medicine Inc. Common Stock,$37.54,-0.69,-1.805%,2562527513.00,United States,2016,1408546,Health Care,Biotechnology: Pharmaceutical Preparations
EDNCU,Endurance Acquisition Corp. Unit,$9.92,-0.0101,-0.102%,0.00,United States,2021,7341,,
EDRY,EuroDry Ltd. Common Shares ,$29.46,-1.04,-3.41%,67894400.00,Greece,,39524,Consumer Services,Marine Transportation
EDSA,Edesa Biotech Inc. Common Shares,$7.15,0.04,0.563%,94777247.00,United States,,258113,,
EDTK,Skillful Craftsman Education Technology Limited Ordinary Share,$1.21,0.04,3.419%,18029000.00,China,2020,431512,Consumer Services,Other Consumer Services
EDTX,EdtechX Holdings Acquisition Corp. II Class A common stock,$9.99,-0.0144,-0.144%,143606250.00,United Kingdom,2021,1775,,
EDTXW,EdtechX Holdings Acquisition Corp. II Warrant,$0.5196,-0.0022,-0.422%,0.00,United Kingdom,2021,39067,,
EDUC,Educational Development Corporation Common Stock,$10.00,0.01,0.10%,86502300.00,United States,,48103,Consumer Services,Books
EEFT,Euronet Worldwide Inc. Common Stock,$131.99,-0.36,-0.272%,6972289520.00,United States,1997,251958,Technology,EDP Services
EEIQ,Elite Education Group International Ltd. Common Stock,$4.50,0.08,1.81%,39742731.00,United States,2021,1055599,Consumer Services,Other Consumer Services
EFOI,Energy Focus Inc. Common Stock,$2.82,0.00,0.00%,14340473.00,United States,,174527,Consumer Durables,Building Products
EFSC,Enterprise Financial Services Corporation Common Stock,$46.72,-0.26,-0.553%,1804541265.00,United States,,51451,Finance,Major Banks
EFTR,eFFECTOR Therapeutics Inc. Common Stock,$11.36,-0.77,-6.348%,462004066.00,United States,2021,254159,Health Care,Biotechnology: Pharmaceutical Preparations
EFTRW,eFFECTOR Therapeutics Inc. Warrant,$1.45,-0.04,-2.685%,0.00,United States,2021,59175,Health Care,Biotechnology: Pharmaceutical Preparations
EGAN,eGain Corporation Common Stock,$10.28,-0.06,-0.58%,322376256.00,United States,1999,69590,Technology,Computer Software: Prepackaged Software
EGBN,Eagle Bancorp Inc. Common Stock,$58.27,-0.50,-0.851%,1862348998.00,United States,,111456,Finance,Major Banks
EGLE,Eagle Bulk Shipping Inc. Common Stock,$50.55,-2.69,-5.053%,680396176.00,United States,,544487,Transportation,Marine Transportation
EGLX,Enthusiast Gaming Holdings Inc. Common Stock,$3.51,-0.26,-6.897%,450050870.00,Canada,,521519,,
EGRX,Eagle Pharmaceuticals Inc. Common Stock,$55.44,-0.77,-1.37%,726103945.00,United States,2014,92365,Health Care,Biotechnology: Pharmaceutical Preparations
EH,EHang Holdings Limited ADS,$21.31,-0.62,-2.827%,1181192693.00,China,2019,898419,Transportation,Air Freight/Delivery Services
EHTH,eHealth Inc. Common Stock,$41.03,0.36,0.885%,1074399927.00,United States,2006,227177,Finance,Specialty Insurers
EIGR,Eiger BioPharmaceuticals Inc. Common Stock,$6.53,0.06,0.927%,221702080.00,United States,2014,172665,Health Care,Biotechnology: Biological Products (No Diagnostic Substances)
EJFA,EJF Acquisition Corp. Class A Ordinary Share,$9.90,0.00,0.00%,355781250.00,United States,2021,25809,Finance,Business Services
EJFAU,EJF Acquisition Corp. Unit,$10.50,0.16,1.547%,0.00,United States,2021,1425,Finance,Business Services
EJFAW,EJF Acquisition Corp. Warrant,$1.60,0.06,3.896%,0.00,United States,2021,9501,Finance,Business Services
EJH,E-Home Household Service Holdings Limited Ordinary Shares,$2.17,-0.14,-6.061%,72871977.00,China,2021,857942,Consumer Services,Other Consumer Services
EKSO,Ekso Bionics Holdings Inc. Common Stock,$4.27,-0.03,-0.698%,54038221.00,United States,,37432,Health Care,Medical/Dental Instruments
ELDN,Eledon Pharmaceuticals Inc. Common Stock,$5.94,0.25,4.394%,84981287.00,United States,2014,23566,Health Care,Biotechnology: Pharmaceutical Preparations
ELEV,Elevation Oncology Inc. Common stock,$7.63,0.12,1.598%,177211610.00,United States,2021,15919,Health Care,Biotechnology: Pharmaceutical Preparations
ELMS,Electric Last Mile Solutions Inc. Class A Common stock,$6.58,-0.16,-2.374%,816097739.00,United States,2021,476743,Capital Goods,Auto Manufacturing
ELMSW,Electric Last Mile Solutions Inc. Warrant,$1.48,-0.03,-1.987%,0.00,United States,2020,22400,Capital Goods,Auto Manufacturing
ELOX,Eloxx Pharmaceuticals Inc. Common Stock,$1.54,-0.04,-2.532%,132752269.00,United States,,297556,Health Care,Biotechnology: Pharmaceutical Preparations
ELSE,Electro-Sensors Inc. Common Stock,$5.08,0.02,0.395%,17249247.00,United States,,7074,Capital Goods,Industrial Machinery/Components
ELTK,Eltek Ltd. Ordinary Shares,$5.67,-0.06,-1.047%,24836120.00,Israel,1997,11486,Technology,Electrical Products
ELYM,Eliem Therapeutics Inc Common Stock,$17.83,-2.64,-12.897%,473349075.00,United States,2021,128719,Health Care,Biotechnology: Pharmaceutical Preparations
ELYS,Elys Game Technology Corp. Common Stock,$4.75,-0.11,-2.263%,79159220.00,Canada,,179279,Consumer Services,Movies/Entertainment
EM,Smart Share Global Limited American Depositary Shares,$2.84,-0.13,-4.377%,708398447.00,China,2021,126636,Consumer Services,Other Consumer Services
EMCF,Emclaire Financial Corp Common Stock,$26.03,-0.2628,-1.00%,70833148.00,United States,,1016,Finance,Major Banks
EMKR,EMCORE Corporation Common Stock,$7.18,-0.13,-1.778%,264831026.00,United States,1997,197356,Technology,Semiconductors
EML,Eastern Company (The) Common Stock,$24.335,-0.875,-3.471%,152550129.00,United States,,2964,Capital Goods,Industrial Specialties
ENDP,Endo International plc Ordinary Shares,$3.39,-0.09,-2.586%,791565949.00,Ireland,,4602977,Health Care,Biotechnology: Pharmaceutical Preparations
ENFA,890 5th Avenue Partners Inc. Class A Common Stock,$9.935,-0.005,-0.05%,364763525.00,United States,2021,10289,,
ENFAU,890 5th Avenue Partners Inc. Unit,$10.31,-0.02,-0.194%,0.00,United States,2021,1010,,
ENFAW,890 5th Avenue Partners Inc. Warrant,$1.27,0.00,0.00%,0.00,United States,2021,6768,,
ENG,ENGlobal Corporation Common Stock,$2.50,-0.33,-11.661%,87836410.00,United States,,4228384,Consumer Services,Military/Government/Technical
ENLV,Enlivex Therapeutics Ltd. Ordinary Shares,$9.66,0.04,0.416%,130060028.00,Israel,2014,55462,Health Care,Biotechnology: Pharmaceutical Preparations
ENNV,ECP Environmental Growth Opportunities Corp. Class A Common Stock,$9.90,0.01,0.101%,426937500.00,United States,2021,31984,,
ENNVW,ECP Environmental Growth Opportunities Corp. Warrants,$0.7833,-0.0067,-0.848%,0.00,United States,2021,22118,,
ENOB,Enochian Biosciences Inc. Common Stock,$6.93,0.12,1.762%,361882251.00,United States,,142171,Health Care,Biotechnology: Pharmaceutical Preparations
ENPH,Enphase Energy Inc. Common Stock,$153.58,6.17,4.186%,20675123282.00,United States,2012,2355602,Capital Goods,Electrical Products
ENSC,Ensysce Biosciences Inc. Common Stock,$2.52,0.18,7.692%,61124581.00,United States,,408318,Health Care,Biotechnology: Pharmaceutical Preparations
ENSG,The Ensign Group Inc. Common Stock,$73.65,-1.64,-2.178%,4060922833.00,United States,2007,285387,Health Care,Hospital/Nursing Management
ENTA,Enanta Pharmaceuticals Inc. Common Stock,$61.20,0.68,1.124%,1237148820.00,United States,2013,134373,Health Care,Biotechnology: In Vitro & In Vivo Diagnostic Substances
ENTG,Entegris Inc. Common Stock,$120.36,-0.81,-0.668%,16320509202.00,United States,2000,594976,Technology,Semiconductors
ENTX,Entera Bio Ltd. Ordinary Shares,$4.48,-0.10,-2.183%,81689176.00,Israel,2018,169359,Health Care,Biotechnology: Biological Products (No Diagnostic Substances)
ENTXW,Entera Bio Ltd. Warrant,$0.558,0.078,16.25%,0.00,Israel,2018,21690,Health Care,Biotechnology: Biological Products (No Diagnostic Substances)
ENVB,Enveric Biosciences Inc. Common Stock,$1.82,-0.01,-0.546%,39006995.00,United States,,1275386,Health Care,Biotechnology: Pharmaceutical Preparations
ENVI,Environmental Impact Acquisition Corp. Class A Common Stock,$9.93,0.02,0.202%,256938750.00,United States,2021,22384,,
ENVIU,Environmental Impact Acquisition Corp. Unit,$10.40,-0.01,-0.096%,0.00,United States,2021,1311,,
ENVIW,Environmental Impact Acquisition Corp. Warrant,$1.10,0.00,0.00%,0.00,United States,2021,22331,,
ENVX,Enovix Corporation Common Stock,$20.29,0.78,3.998%,2947034096.00,United States,2021,933045,Capital Goods,Industrial Machinery/Components
ENVXW,Enovix Corporation Warrant,$9.36,0.22,2.407%,0.00,United States,2021,31541,Capital Goods,Industrial Machinery/Components
EOLS,Evolus Inc. Common Stock,$7.10,-0.20,-2.74%,387490708.00,United States,2018,411593,Consumer Durables,Specialty Chemicals
EOSE,Eos Energy Enterprises Inc. Class A Common Stock,$11.96,-1.03,-7.929%,641488832.00,United States,,325803,Technology,Electronic Components
EOSEW,Eos Energy Enterprises Inc. Warrant,$3.93,-0.44,-10.069%,0.00,United States,,25595,Technology,Electronic Components
EPAY,Bottomline Technologies Inc. Common Stock,$38.50,-0.31,-0.799%,1757141194.00,United States,1999,251544,Technology,EDP Services
EPHY,Epiphany Technology Acquisition Corp. Class A Common Stock,$9.75,-0.02,-0.205%,498346875.00,United States,2021,23913,,
EPHYU,Epiphany Technology Acquisition Corp. Unit,$10.002,0.002,0.02%,0.00,United States,2021,10675,,
EPHYW,Epiphany Technology Acquisition Corp. Warrant,$0.9016,-0.0185,-2.011%,0.00,United States,2021,8724,,
EPIX,ESSA Pharma Inc. Common Stock,$7.95,-0.79,-9.039%,230617662.00,Canada,,172196,,
EPSN,Epsilon Energy Ltd. Common Share,$5.80,0.02,0.346%,136473327.00,United States,,46297,,
EPZM,Epizyme Inc. Common Stock,$4.95,0.03,0.61%,506135109.00,United States,2013,594260,Health Care,Biotechnology: Pharmaceutical Preparations
EQ,Equillium Inc. Common Stock,$6.83,-0.16,-2.289%,200684565.00,United States,2018,134811,Health Care,Biotechnology: Pharmaceutical Preparations
EQBK,Equity Bancshares Inc. Class A Common Stock,$34.45,-0.26,-0.749%,494789021.00,United States,2015,17514,Finance,Finance: Consumer Services
EQIX,Equinix Inc. Common Stock REIT,$762.32,2.25,0.296%,2138074330.00,United States,2000,725912,Consumer Services,Real Estate Investment Trusts
EQOS,Diginex Limited Ordinary Shares,$3.75,0.58,18.297%,146429078.00,Singapore,2019,1726575,Miscellaneous,Business Services
ERAS,Erasca Inc. Common Stock,$19.10,-3.65,-16.044%,2315299422.00,United States,2021,593717,Health Care,Biotechnology: Pharmaceutical Preparations
ERES,East Resources Acquisition Company Class A Common Stock,$9.85,0.02,0.203%,424781250.00,United States,2020,20217,,
ERESU,East Resources Acquisition Company Unit,$10.13,0.00,0.00%,0.00,United States,2020,8,,
ERESW,East Resources Acquisition Company Warrant,$0.58,-0.008,-1.361%,0.00,United States,2020,39924,,
ERIC,Ericsson American Depositary Shares,$11.34,-0.03,-0.264%,37807560000.00,Sweden,,5948409,Technology,Computer Software: Prepackaged Software
ERIE,Erie Indemnity Company Class A Common Stock,$184.76,-0.29,-0.157%,9661076012.00,United States,,60753,Finance,Specialty Insurers
ERII,Energy Recovery Inc. Common Stock,$19.48,0.05,0.257%,1113326804.00,United States,2008,226699,Technology,Industrial Machinery/Components
ERYP,Erytech Pharma S.A. American Depositary Shares,$5.91,-0.16,-2.636%,163863893.00,France,2017,25939,Health Care,Biotechnology: Biological Products (No Diagnostic Substances)
ESBK,Elmira Savings Bank Elmira NY Common Stock,$22.65,-0.05,-0.22%,79551466.00,United States,,104725,Finance,Major Banks
ESCA,Escalade Incorporated Common Stock,$18.71,-0.07,-0.373%,257194489.00,United States,,16199,Consumer Non-Durables,Recreational Products/Toys
ESEA,Euroseas Ltd. Common Stock (Marshall Islands),$33.70,-0.53,-1.548%,188728728.00,Greece,,89757,Transportation,Marine Transportation
ESGR,Enstar Group Limited Ordinary Shares,$240.09,-1.71,-0.707%,4412891894.00,Bermuda,,27007,Finance,Property-Casualty Insurers
ESGRO,Enstar Group Limited Depository Shares 7.00% Perpetual Non-Cumulative Preference Shares Series E,$26.82,0.13,0.487%,0.00,Bermuda,,13342,Finance,Property-Casualty Insurers
ESGRP,Enstar Group Limited Depositary Shares Each Representing 1/1000th of an interest in Preference Shares,$28.96,0.23,0.801%,0.00,Bermuda,,11556,Finance,Property-Casualty Insurers
ESLT,Elbit Systems Ltd. Ordinary Shares,$144.73,-0.20,-0.138%,6397609606.00,Israel,,8783,Capital Goods,Military/Government/Technical
ESPR,Esperion Therapeutics Inc. Common Stock,$10.17,-0.37,-3.51%,287582104.00,United States,2013,770810,Health Care,Biotechnology: Pharmaceutical Preparations
ESQ,Esquire Financial Holdings Inc. Common Stock,$30.22,-0.28,-0.918%,236643875.00,United States,2017,15326,Finance,Commercial Banks
ESSA,ESSA Bancorp Inc. Common Stock,$16.35,-0.31,-1.861%,171556986.00,United States,,683,Finance,Banks
ESSC,East Stone Acquisition Corporation Ordinary Shares,$10.20,-0.01,-0.098%,180575700.00,United States,2020,289049,Finance,Business Services
ESSCR,East Stone Acquisition Corporation Right,$0.422,-0.0081,-1.883%,0.00,United States,2020,52400,Technology,Computer Software: Programming Data Processing
ESSCW,East Stone Acquisition Corporation Warrant,$0.2607,-0.0093,-3.444%,0.00,United States,2020,21984,Technology,Computer Software: Programming Data Processing
ESTA,Establishment Labs Holdings Inc. Common Shares,$71.20,-0.72,-1.001%,1690241934.00,Costa Rica,2018,84062,Health Care,Industrial Specialties
ESXB,Community Bankers Trust Corporation Common Stock (VA),$11.31,-0.08,-0.702%,253926047.00,United States,,35997,Finance,Major Banks
ETAC,E.Merge Technology Acquisition Corp. Class A Common Stock,$9.82,0.00,0.00%,748284000.00,United States,2020,76857,,
ETACU,E.Merge Technology Acquisition Corp. Unit,$10.03,-0.01,-0.10%,0.00,United States,2020,810,,
ETACW,E.Merge Technology Acquisition Corp. Warrant,$0.73,0.0225,3.18%,0.00,United States,2020,23652,,
ETNB,89bio Inc. Common Stock,$18.01,-0.27,-1.477%,361781566.00,United States,2019,43234,Health Care,Biotechnology: Pharmaceutical Preparations
ETON,Eton Pharmaceuticals Inc. Common Stock,$4.74,-0.09,-1.863%,116604830.00,United States,2018,70351,Health Care,Biotechnology: Pharmaceutical Preparations
ETSY,Etsy Inc. Common Stock,$209.53,5.89,2.892%,26521636275.00,United States,2015,1539473,Consumer Services,Catalog/Specialty Distribution
ETTX,Entasis Therapeutics Holdings Inc. Common Stock,$3.01,-0.17,-5.346%,142403865.00,United States,2018,280540,Health Care,Biotechnology: Pharmaceutical Preparations
EUCR,Eucrates Biomedical Acquisition Corp. Ordinary Shares,$9.76,-0.015,-0.153%,131361060.00,United States,2020,1288,Finance,Business Services
EUSG,European Sustainable Growth Acquisition Corp. Class A Ordinary Shares,$9.905,0.0173,0.175%,178574769.00,United States,2021,7916,Finance,Business Services
EUSGU,European Sustainable Growth Acquisition Corp. Unit,$10.46,0.00,0.00%,0.00,United States,2021,200,Finance,Business Services
EUSGW,European Sustainable Growth Acquisition Corp. Warrant,$1.29,0.03,2.381%,0.00,United States,2021,9255,Finance,Business Services
EVAX,Evaxion Biotech A/S American Depositary Share,$8.70,-0.15,-1.695%,167028412.00,Denmark,2021,9259,Health Care,Biotechnology: Biological Products (No Diagnostic Substances)
EVBG,Everbridge Inc. Common Stock,$146.77,2.17,1.501%,5633836753.00,United States,2016,247553,Technology,Retail: Computer Software & Peripheral Equipment
EVCM,EverCommerce Inc. Common Stock,$18.40,0.99,5.686%,3594197764.00,United States,2021,308577,Technology,EDP Services
EVER,EverQuote Inc. Class A Common Stock,$17.69,-0.33,-1.831%,514360118.00,United States,2018,104409,Technology,EDP Services
EVFM,Evofem Biosciences Inc. Common Stock,$0.7349,-0.0014,-0.19%,114062694.00,United States,2014,1686650,Health Care,Biotechnology: Pharmaceutical Preparations
EVGN,Evogene Ltd Ordinary Shares,$2.49,-0.09,-3.488%,101146599.00,Israel,,239276,Basic Industries,Agricultural Chemicals
EVGO,EVgo Inc. Class A Common Stock,$7.85,-0.23,-2.847%,2076613645.00,United States,,2180909,Consumer Services,Catalog/Specialty Distribution
EVGOW,EVgo Inc. Warrants,$1.75,-0.03,-1.685%,0.00,United States,,20341,Consumer Services,Catalog/Specialty Distribution
EVK,Ever-Glory International Group Inc. Common Stock,$2.55,-0.11,-4.135%,37767183.00,China,,53743,Consumer Non-Durables,Apparel
EVLMC,Eaton Vance NextShares Trust II Eaton Vance TABS 5-to-15 Year Laddered Municipal Bond NextShares,$99.96,0.00,0.00%,0.00,United States,,39,Finance,Investment Managers
